{
  "name": "places/ChIJN1t_tDeuEmsRUsoyG83frY4",
  "rating": 4.5,
  "text": {
    "text": "Google Building 40",
    "languageCode": "en"
  },
  "originalText": {
    "text": "Google Building 40",
    "languageCode": "en"
  },
  "relativePublishTimeDescription": "Monday: 9:00 AM - 5:00 PM",
  "publishTime": "2026-03-15T14:30:00Z",
  "authorAttribution": {
    "displayName": "Googleplex",
    "uri": "https://maps.google.com/?cid=12345678901234567890",
    "photoUri": "https://places.googleapis.com/v1/places/ChIJ/photos/AeJ/media"
  }
}